{
  "contract_version": "1.0.0",
  "data_mode": "demo",
  "currency": "USD",
  "provider_status": {
    "connected": false,
    "adapter": "curated_demo_packages",
    "readiness": "orchestration_contract_ready",
    "bookable": false,
    "components": {
      "flights": "demo",
      "hotels": "demo",
      "insurance": "fictional_demo",
      "transfers": "demo"
    }
  },
  "origin": {
    "code": "TLV",
    "city": "תל אביב",
    "airport": "Ben Gurion Airport",
    "latitude": 32.0005,
    "longitude": 34.8708,
    "position": { "x": 72, "y": 76 }
  },
  "destination": {
    "id": "budapest",
    "code": "BUD",
    "city": "בודפשט",
    "country": "הונגריה",
    "airport": "Budapest Ferenc Liszt International",
    "latitude": 47.4979,
    "longitude": 19.0402,
    "position": { "x": 42, "y": 31 }
  },
  "insurance_catalog": {
    "none": { "id": "none", "name": "ללא ביטוח בחישוב", "daily_adult": 0, "daily_child": 0, "medical_limit": 0, "service": "לא נכלל", "purchasable": false },
    "essential": { "id": "demo-essential", "name": "Essential", "daily_adult": 2.4, "daily_child": 1.55, "medical_limit": 5000000, "service": "מוקד חירום 24/7", "purchasable": false },
    "assisted": { "id": "demo-assisted", "name": "Assisted", "daily_adult": 3.8, "daily_child": 2.45, "medical_limit": 5000000, "service": "מוקד חירום 24/7 וצ׳אט", "purchasable": false },
    "extended": { "id": "demo-extended", "name": "Extended", "daily_adult": 5.4, "daily_child": 3.5, "medical_limit": 10000000, "service": "מוקד חירום ושירות דיגיטלי", "purchasable": false }
  },
  "packages": [
    {
      "id": "budapest-smart-demo",
      "name": "החבילה החכמה לעיר",
      "badge": "האיזון המומלץ",
      "base_score": 96,
      "flight": {
        "airline": "EL AL",
        "airline_code": "LY",
        "direct": true,
        "stops": 0,
        "duration_minutes": 215,
        "departure_time": "07:10",
        "return_time": "20:35",
        "ticket_mode": "single",
        "risk": "low",
        "cabin": "economy",
        "baggage_included": true,
        "adult_price": 318,
        "child_price": 249,
        "baggage_addon": 0
      },
      "stay": {
        "property_id": "danube-house-demo",
        "name": "Danube House Budapest",
        "area_id": "district-v",
        "area_name": "מרכז העיר והדנובה",
        "stars": 4,
        "guest_score": 9.2,
        "room": "חדר זוגי דלקס",
        "sleeps": 2,
        "nightly": 128,
        "taxes": 54,
        "fees": 12,
        "free_cancellation": true,
        "breakfast_included": true,
        "breakfast_daily_adult": 0,
        "breakfast_daily_child": 0,
        "route_minutes": 6,
        "airport_minutes": 35,
        "image": "city-budapest.webp",
        "position": { "x": 52, "y": 52 }
      },
      "default_insurance_tier": "assisted",
      "transfer": { "mode": "shared", "label": "העברה משותפת לשני הכיוונים", "base": 44, "per_traveler": 4 },
      "traits": { "comfort": 89, "flexibility": 88, "location": 96, "simplicity": 94, "risk": "low" },
      "pros": ["טיסה ישירה, כבודה וארוחת בוקר כבר בחישוב", "מלון במרחק קצר מהמסלול המרכזי", "כל רכיב מוצג בנפרד לפני בחירה"],
      "cons": ["לא החבילה הזולה ביותר", "העברה משותפת ולא פרטית"],
      "booking": { "bookable": false, "provider": "demo", "checkout_url": null }
    },
    {
      "id": "budapest-value-demo",
      "name": "בודפשט במחיר מינימלי",
      "badge": "העלות הנמוכה",
      "base_score": 82,
      "flight": {
        "airline": "Wizz Air",
        "airline_code": "W6",
        "direct": true,
        "stops": 0,
        "duration_minutes": 205,
        "departure_time": "21:40",
        "return_time": "06:15",
        "ticket_mode": "single",
        "risk": "medium",
        "cabin": "economy",
        "baggage_included": false,
        "adult_price": 214,
        "child_price": 189,
        "baggage_addon": 58
      },
      "stay": {
        "property_id": "quarter-social-demo",
        "name": "Quarter Social Rooms",
        "area_id": "jewish-quarter",
        "area_name": "הרובע היהודי",
        "stars": 3,
        "guest_score": 8.8,
        "room": "חדר זוגי שקט",
        "sleeps": 2,
        "nightly": 96,
        "taxes": 42,
        "fees": 10,
        "free_cancellation": true,
        "breakfast_included": false,
        "breakfast_daily_adult": 14,
        "breakfast_daily_child": 9,
        "route_minutes": 10,
        "airport_minutes": 38,
        "image": "hero-budapest-900.webp",
        "position": { "x": 61, "y": 43 }
      },
      "default_insurance_tier": "essential",
      "transfer": { "mode": "public", "label": "כרטיסי תחבורה משדה התעופה", "base": 12, "per_traveler": 8 },
      "traits": { "comfort": 68, "flexibility": 76, "location": 88, "simplicity": 74, "risk": "medium" },
      "pros": ["הסכום הכולל הנמוך ביותר בדוגמה", "טיסה ישירה ואזור מרכזי", "אפשר להוסיף רק את הרכיבים שבאמת צריכים"],
      "cons": ["שעות טיסה פחות נוחות", "כבודה וארוחת בוקר עולות בנפרד"],
      "booking": { "bookable": false, "provider": "demo", "checkout_url": null }
    },
    {
      "id": "budapest-flex-demo",
      "name": "גמישות ונוחות מלאה",
      "badge": "הכי רגוע",
      "base_score": 91,
      "flight": {
        "airline": "EL AL",
        "airline_code": "LY",
        "direct": true,
        "stops": 0,
        "duration_minutes": 215,
        "departure_time": "10:20",
        "return_time": "18:10",
        "ticket_mode": "single-flex",
        "risk": "low",
        "cabin": "economy-flex",
        "baggage_included": true,
        "adult_price": 389,
        "child_price": 298,
        "baggage_addon": 0
      },
      "stay": {
        "property_id": "castle-view-demo",
        "name": "Castle View Residence",
        "area_id": "buda-castle",
        "area_name": "בודה ואזור המצודה",
        "stars": 4,
        "guest_score": 9.0,
        "room": "סוויטת סטודיו",
        "sleeps": 3,
        "nightly": 142,
        "taxes": 48,
        "fees": 0,
        "free_cancellation": true,
        "breakfast_included": true,
        "breakfast_daily_adult": 0,
        "breakfast_daily_child": 0,
        "route_minutes": 16,
        "airport_minutes": 42,
        "image": "city-budapest.webp",
        "position": { "x": 34, "y": 49 }
      },
      "default_insurance_tier": "extended",
      "transfer": { "mode": "private", "label": "העברה פרטית לשני הכיוונים", "base": 84, "per_traveler": 7 },
      "traits": { "comfort": 97, "flexibility": 97, "location": 78, "simplicity": 96, "risk": "low" },
      "pros": ["טיסה גמישה, מלון עם ביטול והעברה פרטית", "שעות נוחות ושירותים רחבים יותר", "רמת הסיכון התפעולי הנמוכה בדוגמה"],
      "cons": ["העלות הכוללת הגבוהה ביותר", "המלון שקט אך רחוק יותר ממסלול הערב"],
      "booking": { "bookable": false, "provider": "demo", "checkout_url": null }
    },
    {
      "id": "budapest-family-demo",
      "name": "החבילה המשפחתית",
      "badge": "מרחב למשפחה",
      "base_score": 92,
      "flight": {
        "airline": "Arkia",
        "airline_code": "IZ",
        "direct": true,
        "stops": 0,
        "duration_minutes": 220,
        "departure_time": "08:25",
        "return_time": "17:45",
        "ticket_mode": "single",
        "risk": "low",
        "cabin": "economy",
        "baggage_included": true,
        "adult_price": 309,
        "child_price": 229,
        "baggage_addon": 0
      },
      "stay": {
        "property_id": "park-family-demo",
        "name": "Park Family Aparthotel",
        "area_id": "city-park",
        "area_name": "פארק העיר והגיבורים",
        "stars": 4,
        "guest_score": 8.9,
        "room": "דירת חדר שינה",
        "sleeps": 4,
        "nightly": 132,
        "taxes": 45,
        "fees": 0,
        "free_cancellation": true,
        "breakfast_included": true,
        "breakfast_daily_adult": 0,
        "breakfast_daily_child": 0,
        "route_minutes": 18,
        "airport_minutes": 32,
        "image": "hero-budapest-900.webp",
        "position": { "x": 72, "y": 27 }
      },
      "default_insurance_tier": "assisted",
      "transfer": { "mode": "private-family", "label": "העברה פרטית עם מקום למזוודות", "base": 76, "per_traveler": 6 },
      "traits": { "comfort": 92, "flexibility": 91, "location": 72, "simplicity": 92, "risk": "low" },
      "pros": ["חדר שמתאים לארבעה נוסעים ללא פיצול", "כבודה, ארוחת בוקר והעברה נוחה למשפחה", "ביטול גמיש ומרחב אמיתי בדירה"],
      "cons": ["יותר זמן בתחבורה למרכז", "פחות מתאים למי שמחפש חיי לילה"],
      "booking": { "bookable": false, "provider": "demo", "checkout_url": null }
    }
  ]
}
